title	score	id	subreddit	url	numofcomments	selftext	created
I’ve Been Flying for almost Thirty Hours and The Flight Attendants Won’t Stop Crying [Part 3]	1801	dmyq8g	nosleep	https://www.reddit.com/r/nosleep/comments/dmyq8g/ive_been_flying_for_almost_thirty_hours_and_the/	82	"[Read Part 1 Here](https://www.reddit.com/r/nosleep/comments/dlk100/ive_been_flying_for_almost_thirty_hours_and_the/?st=k269q0gn&sh=f6440917)

[Read Part 2 Here](https://www.reddit.com/r/nosleep/comments/dm86h5/ive_been_flying_for_almost_thirty_hours_and_the/?st=k269q1qh&sh=b655a8d9)

After another dozen hours or so, I opened the bathroom door. The lights in the cabin were back to normal and I couldn’t smell any sulfur. 

I cautiously made my way back to my seat and almost cried when the grinning crying flight attendant came by offering a meal. That crappy airline food was the most delicious thing I’d ever eaten. 

When I’d finished, my mind immediately turned to Mary. What had happened to her?

I crept down the aisle towards first class, trying to keep a low profile. Surprisingly, the flight attendants were nowhere to be seen. They’d almost seemed to ignore me, almost as if they wanted me to find her.

She had a row to herself and was staring down at her phone in the window seat. I slid into the aisle and shook her arm. 

“Mary!” I hissed.

She pulled out her headphones and stared at me with a surprised expression. “Yeah? What’s going on?”

“Are you ok?” I asked. “What did that thing do to you? What did they do to you?”

“I’m sorry, remind me how I know you?”

“What do you mean? We just-” I realized with sinking horror that she had no idea who I was. I fought back tears. “Mary, how long have you been on this flight?”

She checked the watch on her wrist. “Well it’s 4:03 AM so a few hours at least.” She stared at me the same way you’d look at a person claiming they were the second coming of Christ. Her tone was low and reassuring. “Hey, don’t worry so much. Look on the bright side; we’ll be landing in about an hour.”

I felt an iron grip on my arm and looked up to see two flight attendants. “Sir, this area is for first-class passengers only.” 

They were still crying and grinning, but just with tears this time. I could still see streaks of blood staining the front of their uniforms though. 

I was escorted back to my seat where I spent the next several days. Attendants continued to stop by with food, I would use the bathroom, and soon was going absolutely crazy with the monotony. 

In retrospect, those few days weren’t so bad. There’s a lot of content on the internet after all, even with crappy plane WiFi. No, it didn’t get really bad until around ten days later when the WiFi failed.

It was sometime a week later that I lost control and began screaming for a flight attendant. They didn’t come for several minutes, but eventually one did.

“Just...just let me see the Captain,” I asked.

The flight attendant bent low and spoke with that same customer-service voice: “I’m sorry sir, the captain has made his decision regarding you quite clear. You didn’t answer his call, and will, therefore, wait.”

“How long?”

“Quite a while I’m afraid. Don’t worry though sir, we’ll be landing in about an hour.” She straightened and walked away.

I started making notches on various parts of the seatback to keep track of different things. One notch for each time I used the bathroom, one for each meal, one for every time I watched Thor Ragnarok, that sort of thing. 

It was hell. I watched every movie in the seatback a dozen times over. If I ever acted out badly enough, I would be escorted back to my seat by one or more flight attendants. Any attempt at conversation with other passengers was met with confusion by them followed by a quick escort back to my seat.

I’d guess it was on or around day thirty that, in a moment of panic and psychosis, I broke my laptop and phone, screaming at the top of my lungs. No one around me reacted in any way. 

Two months later, I stunk. The muscles in my legs were tight and cramped constantly. I finally concluded that suicide was my only option after my hundred-and-twenty-eight rewatch of Thor Ragnarok. 

I got to my feet and limped towards the emergency exit. I knew normally the pressure inside the airplane forced the doors closed, but I figured that nothing about my situation was normal. If this didn’t work, I’d find some other more painful way to go. 

I grabbed at the handle and swung it up. To my shock, the door opened easily, though no wind of any kind whipped around the cabin. It remained the standard slightly-too-cold temperature that it’d been for the past who-knew how long. 

The open door called to me, a black portal out of the plane. I stared at it for a long moment, almost too long. An attendant’s hand grabbed my shoulder, pulling me away. In a fit of anger and strength that surprised me, I wrenched away and jumped out of the plane. 

The wind whipping past my face was almost magical, a new sensation after so many months of the same. The ocean below me grew closer and larger, and I realized that suddenly, I didn’t want to die after all. 

It grew larger and larger and larger until it seemed that all I could see was darkness and waves.

I impacted the surface of the water so fast and hard that my entire body jerked around in the seat. I pulled my hand back, sucking at my bruised knuckle. I’d hit it on the seat in front of me.

“No,” I whispered. Then shouted. “NO! NO! NO!”

A flight attendant ran down the aisle, kneeling beside me. “Are you OK sir?”

I clenched my hands into fists, almost swinging at her. But then I realized. 

She wasn’t grinning.

She wasn’t crying. 

To be honest she looked a little scared of me.

I reached my right hand down to my pocket where I could feel my now-unbroken phone. 

4:04 AM.

“Sir, if you can calm down we’ll be landing in about an hour.”

My mouth tasted like ash. “Thank you,” I managed. “I will.”

I stared unblinking at my phone. It now displayed 4:05 AM.

Then I looked out my window and began to cry at the sight of city lights below me. 

We did land in about an hour. I can’t even begin to explain why or how, but I’m currently sitting in an airport cafe typing this out. I’m free. I’m out.

And I’m never going flying again.

---------------------------

---------------------------


EDIT: I sure hope the bartender here at the airport just has a naturally wide grin.

[More](https://JamesWorchester.com)"	1572044725.0
MEOW_IRL	3020	dmwpyr	MEOW_IRL	https://i.redd.it/llh8hfofkou31.png	10		1572035142.0
LPT: to retire in this economy, don't be poor	37029	dmth2x	MurderedByWords	https://i.redd.it/w4gpgnqaumu31.jpg	1112		1572014279.0
"Been watching too much anime and was inspired to try making some ""bento"" lunches to take to work. I made 5 of these"	2518	dmx2ab	MealPrepSunday	https://i.redd.it/zvn8ms0vpou31.jpg	94		1572036969.0
Mesmerising paint mixing, gets me all the time.	31294	dmuuhd	oddlysatisfying	https://v.redd.it/qe6cgdllmnu31	347		1572023786.0
And for his neutral B he wields a gun!	6610	dmvdjx	SmashBrosUltimate	https://i.redd.it/frdjqjz5xnu31.png	75		1572027318.0
I feel like this guy and parrot are soul mates	1926	dmy6uq	whitepeoplegifs	https://gfycat.com/tinymarriedbluebreastedkookaburra	32		1572042339.0
Doofenshmirtz Evil Incorporated	14540	dmwq61	Minecraft	https://i.redd.it/nazi9aejkou31.jpg	187		1572035178.0
Where’s the lie tho	7132	dmx0u9	rareinsults	https://i.redd.it/brr2chm7pou31.png	67		1572036750.0
Alisa I	5999	dmuvo5	nsfw	https://i.imgur.com/oelgzLc.jpg	34		1572024010.0
Never thought I’d find one this good in the wild	1320	dmzy48	AteTheOnion	https://i.imgur.com/hYraZB7.jpg	40		1572049990.0
CM Punk: “AEW should focus on themselves and stop talking about WWE”	2550	dmww4u	SquaredCircle	https://screenrant.com/cm-punk-girl-third-floor-interview/	1040		1572036046.0
Things are much better now.	76962	dmv1xr	memes	https://i.redd.it/d25ge1evqnu31.png	740		1572025202.0
The first punch was good	6893	dmv5du	fightporn	https://v.redd.it/4re3ma4kpku31	58		1572025858.0
Any excuse for the orange deviant.	3977	dmw375	bertstrips	https://i.redd.it/si6d3ohv9ou31.jpg	24		1572031643.0
manchester uk	1900	dmy17f	raining	https://i.redd.it/qkkyhurn3pu31.jpg	55		1572041621.0
New Operator Suggestion	13999	dmuvut	Rainbow6	https://i.redd.it/8howdxxcnnu31.png	670		1572024045.0
Tesla overtakes GM as US' most valuable carmaker as TSLA shorts feel $1.4B burn	1770	dmyb3m	teslamotors	https://www.teslarati.com/tesla-tsla-overtakes-gm-1-billion-short-burn/	234		1572042886.0
I’m cultivating mass!	19480	dmt4yf	IASIP	https://i.redd.it/jtg7ysahnmu31.png	292		1572011954.0
Oh no.	7705	dmvy2p	youngpeopleyoutube	https://i.redd.it/w5xb7shi7ou31.png	132		1572030805.0
View through the old and disused railway bridge. Belgrade, Serbia	3949	dmvitm	AbandonedPorn	https://i.redd.it/evpusoixznu31.jpg	15		1572028254.0
FaCeBoOk 🤣🤣🤣🤣🤣🤣🤣🤣	13957	dmult4	comedyhomicide	https://i.redd.it/wxx3ru5uhnu31.jpg	150		1572022161.0
Woman Attacks Cop, Gets Dealt With Swiftly. •	2178	dmxo48	pussypassdenied	https://gfycat.com/realisticcapitalchameleon	103		1572039943.0
Allright then, keep your secrets	2592	dmx7ls	trebuchetmemes	https://i.redd.it/gpy2riozrou31.jpg	11		1572037684.0
When attacked by predators, Hagfish exude copious amounts of slime from some 100 glands running along their flanks. The slime clogs the predator's gills, forcing it to spit out the Hagfish in order to avoid suffocation.	4909	dmv5b9	Awwducational	https://gfycat.com/uniquefragrantislandcanary	89		1572025843.0
Holy Nourishment (-20 Hunger, +15 Strenght, +30 Energy)	7401	dmvdkp	ItemShop	https://i.redd.it/k7ew53e6xnu31.jpg	64		1572027321.0
Chocolate pastry with vanilla center, gilded walnut and a little pool of chocolate sauce on top!	5215	dmv7bk	FoodPorn	https://i.redd.it/ae5y7vxxtnu31.jpg	86		1572026236.0
I’m not crying you are	2145	dmxkox	SequelMemes	https://i.redd.it/u6gz1itcxou31.png	40		1572039490.0
Here's to you	4725	dmv1kk	2007scape	https://i.redd.it/8cjxi2dhqnu31.png	189		1572025133.0
The birds are assembling..we don't have much time	2012	dmy0s9	BirdsArentReal	https://i.redd.it/euxtsjy93pu31.png	23		1572041573.0
"""Sorry boss, I don't speak spanish"""	9859	dmtvik	MaliciousCompliance	https://www.reddit.com/r/MaliciousCompliance/comments/dmtvik/sorry_boss_i_dont_speak_spanish/	261	"I work at a hotel as a night auditor, and this malicious compliance begins with a small bit of information I was told when I was initially hired for this position. When I interviewed for the position, and this is very important later on, I was told by the HR lady that the hotel paid a bonus ($100) for each foreign language I spoke well enough to serve our guests. Management cleared my $100 for speaking english after I passed through their evaluation period (my main language is portuguese).

At first, I was glad to be working in the night shift, mostly because my colleague then, Mr. Castillo was from Guatemala, so whenever any guests that spoke spanis showed up, he handled it and in turn, I handled any english speaking foreigners. Naturally, he did a lot more work since the amount of spanish speaking guests we receive is significantly larger than our english speaking ones. Meanwhile, Mr. Castillo was in the process of learning english and I had taken an interest in spanish so we helped each other out.

Not long after, Mr. Castillo got himself a job paying several times over what the hotel did and sadly, left me. My new colleague, a newly promoted bellboy didn't speak english (though he could understand some) and didn't speak spanish at all. In fact, he didn't even try to improve any of his language skills while I slowly kept improving my spanish, trying to use more and more of it everyday to serve our dear guests. As of the start of this month, I spoke to our frontdesk manager and asked him in plain spanish, what did I have to do exactly to receive the $100 bonus for speaking spanish. He was surprised but said nothing more since the front desk got busy with check-outs and my shift was up, but a few days later he mentioned he spoke to HR and informed them I was speaking spanish well enough to receive my bonus, and now he was just waiting to hear back from them.

A few days later, the HR lady asked me what size shirt I wore since they were going to be ordering new uniforms in the coming weeks, and took the opportunity to ask her about my bonus for spanish and she mentioned they were talking with our director about it. A day later she informed me they wouldn't be paying me the bonus for a foreign language since it was on file that I was already receiving it. I replied I was receiving a bonus for english, not spanish and she said she would speak to the director again and within a few days, all would be made well. Now I'm not really in a hurry to get my bonus, but it would be nice if they had cleared it already, as it would show up in my next paycheck, but guess what? They didn't. Our director talked to HR again, and my boss and told them that, even though I am serving our dear spanish speaking guests, in spanish, I don't in fact, speak spanish.

I'm far from fluent, but I can explain how the hotel works, direct guests to where they need to be and assist them with what they need, be it finding a pharmacy at 3am, getting a cab to go out and get drinks, or even hire an escort (yep), but apparently it isn't good enough for our director and my manager said he can't really afford to fight him on it. Okay, no biggie I guess, maybe we'll try again next year when I can speak a little better I thought. However, the cruel and unforgiving gods of the hotel industry gave me the perfect opportunity to strike back...

Earlier last week we received a large group of 30+ spanish speaking tourists, which in addition to our normal occupancy, meant we were effectively sold out for the week. Big groups are usually a minor incovenience when you're checking them in, but an even bigger problem when checking them out. Especially if they're 1 person per room, which means you basically have a huge load of rooms to check-out, one by one, while an endless line forms in front of the front desk. 80+ checkouts aren't unsual for our hotel on friday mornings, but 110+ is a problem. Normally when the morning shift has a workload this big, our front desk manager comes in early to help, but he couldn't this time since he took a personal day since his mother fell ill. That left our director with only one choice, to ask the night audit to stay late and help until our reservations people clocked in and could then replace us at the front desk.

See, my colleague doesn't like staying late, especially since he works at a second job with his father in the afternoon, meaning he only has the morning and early afternoon to sleep. I don't like staying late on fridays because of the amount of check-outs, which means it'll be forever before you can take a breath and even more so before you can leave. However this time our director didn't even ask my colleague and instead told me to stay late because we would have a sizeable workload and about a third of it would require someone that spoke spanish, or it would slow down everything to a crawl. I told him I would not be staying late that morning and before I could get another word him, he started yammering about how I'm wrong and I should be more of a teamplayer and the he would be very grateful for it. Wanting to get back to my sleep, I told him to ask my colleague and he said he couldn't, that they needed me and when I asked him why, he clearly stated ""We need 2 spanish speakers that morning to make sure everything goes OK with the checkouts."" Not one for missing an opportunity to get payback, I replied ""Sorry boss, I don't speak spanish"", turned off my phone and went back to sleep.

UPDATE: Sorry for holding out on the aftermath. I wrote this during my shift and as I was putting on the finishing touches, we had a server crash and I spent the next hour and a half trying to restore our backups and get the camera system up again.

UPDATE - Aftermath: After I woke up and turned my cellphone back on, I had several missing calls from the hotel and two missing calls from our frontdesk manager (good guy). I called back the hotel but the afternoon shift picked up and they didn't know anything so I called my manager's phone. He answered and asked me what was going on because the director was furious about me ""hanging up on him"" and that I was ""refusing to work"". I explained to him the situation in regards to my bonus for speaking spanish, and since the hotel was trying to hold out on me, I was going to withhold performance. Anyone who's ever worked costumer service know how much damage withholding performance can do, even if it just a little. In the end, my manager begged me to stay until our reservations people came in at 8AM (my shift ends at 07:20AM). I agreed on the condition that I would not check out anyone who spoke spanish. He reluctantly accepeted and said he would back me up in the following shitstorm that would happen.

What happened was that the group came down for breakfast precisely at 6:40AM, finished at 07:10AM give or take and went back to their room to collect their belongings. At this time, the two front desk attendants of the morning shift had arrived, as well as our bellboy, plus, there was me and my colleague waiting to punch out and go. We had already started checking people out and this day was particularly busy, we had 3 or 4 people waiting to be checked out, and it doesn't help that we only have 3 computers for 4 people to work with, with another computer for us to check the cameras. When 07:20AM came up, my colleague quickly picked up his things and left and I took over his spot. At this time the first few people in the group started coming down and they already had to wait since we were all checking out other people. A few minutes later I got the first one but I told them I couldn't check them out since I don't speak spanish and asked them to wait for my colleagues to become available. In the end I ended up refusing service to 10 or so people, which started forming a line right in front of the front desk, which only grew since other guests assumed they were all in line to be checked out. My colleagues on the morning shift were not happy at all, the guests were less than satisfied, and when the first of our reservations people showed up at 8AM, I logged out, punched out and went home. By that time, there was a 20+ line of people waiting to be checked out by 2 overworked recepcionists, only one of which spoke spanish.

In the ensuing shitstorm that happened, the hotel's director arrived at 8:30AM in an attempt to minimize the anger of the human centipede who formed in the front desk, started chatted with the guests and otherwise trying to distract them so they would be less angry and avoid giving the hotel a poor review. I got a mild chewing out by my manager for ""poor work ethic"" instead of being written up. True to his word, he backed me up when the director called him and HR for a meeting regarding my actions (you can't demand someone speak a language that you know they don't right?). I still haven't got my bonus for speaking spanish, and I let my manager know that I will not be speaking any spanish while on the job until they give in and give me my hard earned bonus."	1572016887.0
PIC	3138	dmw7sl	nocontextpics	https://i.redd.it/eeorq1p8cou31.jpg	44		1572032387.0
Brehze 1v4 pistol clutch	1138	dn0k3q	GlobalOffensive	https://clips.twitch.tv/SplendidFunnyBorkBlargNaut	134		1572052621.0
Yucky Red Bull coffee gross :^(	4822	dmvsha	ComedyNecrophilia	https://i.redd.it/zxmh8vgu4ou31.png	32		1572029900.0
Prepare for trouble and make it double!	2845	dmwgd4	Grimdank	https://i.redd.it/y8z605z8gou31.jpg	108		1572033736.0
It tastes like rapes	8049	dmvmzj	ihadastroke	https://i.redd.it/v3f319842ou31.jpg	144		1572028984.0
Santa's sack is so large because he only comes once a year	5092	dmvmka	dadjokes	https://www.reddit.com/r/dadjokes/comments/dmvmka/santas_sack_is_so_large_because_he_only_comes/	126		1572028898.0
Such a nice post, ruined by the sub	3655	dmwmua	lostredditors	https://i.redd.it/b2yky730jou31.png	63		1572034682.0
Spectacular body, and an adorable face	2038	dmxni7	LegalTeens	https://gfycat.com/longsevereflamingo	35		1572039859.0
Anon has low IQ	20296	dmtttp	suicidebywords	https://i.redd.it/8rkqx6d81nu31.jpg	192		1572016578.0
Doot Doot's catnip high is interrupted by his foster sister Shellie wanting my attention.	3737	dmvnlm	StartledCats	https://v.redd.it/wps9mn1d2ou31	42		1572029083.0
What? I moved.	19301	dmth7f	AnimalsBeingJerks	https://i.imgur.com/uRz00lW.gifv	91		1572014300.0
Harvey Weinstein shows up at a young actors event. A stand-up comedian confronts him during her set and gets kicked out. r/television discusses whether a venue is obligated to protect a serial rapist and whether rules of common courtesy apply to those whose influence makes them above the law.	1927	dmxoj0	SubredditDrama	https://old.reddit.com/r/television/comments/dmo8jv/harvey_weinstein_turned_up_at_an_event_for_young/f55bhkm/?context=5	339		1572040003.0
jokey	1777	dmy7yh	Chonkers	https://i.redd.it/z3bh80y86pu31.jpg	12		1572042489.0
love this murloc	3523	dmvldt	wow	https://i.redd.it/yyl5e1n91ou31.jpg	83		1572028704.0
Truly a legend.	1170	dn04g6	brooklynninenine	https://i.redd.it/3k2n8gvsupu31.jpg	16		1572050735.0
Mount Saint Helen?	2084	dmx922	standupshots	https://i.redd.it/94jb21kksou31.png	18		1572037879.0
Presidential Candidate Julián Castro: “I Don’t Consider Atheism a Dirty Word”	2455	dmwnna	atheism	https://www.youtube.com/watch?v=ifquuSBUVlA	113		1572034805.0
Chocolate chip cookies	3710	dmydxy	HistoryMemes	https://i.redd.it/bwp4ee9h8pu31.png	39		1572043233.0
"""The Force of Nature is better than Stock"""	6769	dmuvf8	tf2	https://i.redd.it/2k05np1tmnu31.png	132		1572023966.0
HMFT after I try to steal this handbag	1920	dmxy9z	holdmyfeedingtube	https://gfycat.com/warmheartedfatherlyblackrhino	100		1572041270.0
Good points	3118	dmvviz	HappyEmbarrassedGirls	https://i.redd.it/j27sys996ou31.png	23		1572030375.0
Bernie knew	1410	dmz4ah	theyknew	https://i.redd.it/zem8uew3ipu31.png	25		1572046466.0
What happened to the Magma Wrap? It looks a lot worse than when it first came out, which sucks for people who bought it.	7815	dmv3y0	FortNiteBR	https://i.redd.it/0f6yjq10snu31.png	452		1572025587.0
Pablo Picasso with the revolver he would carry loaded with blanks, which he would shoot at people who asked about the meaning of his paintings (1958)	2506	dmwo6s	OldSchoolCool	https://i.redd.it/nq5zqh3njou31.jpg	203		1572034875.0
You can make everything black instead of two hands holding	3815	dmwd3k	AccidentalRacism	https://i.redd.it/baoklyfreou31.jpg	228		1572033237.0
Racist trash (found on r/gatekeeping)	4247	dmvj50	insanepeoplefacebook	https://i.redd.it/ro3kzz540ou31.jpg	269		1572028323.0
murder is hilarious	2509	dmx59x	ComedyCemetery	https://i.redd.it/8m1xdw44rou31.jpg	24		1572037388.0
Idk if this image is for the heads up grandma	2178	dmx31q	SubredditSimulator	https://i.redd.it/39kmljn1i9v21.jpg	25		1572037091.0
Blursed pregnancy	4634	dmy98d	blursedimages	https://i.redd.it/tsxjh8jq6pu31.png	17		1572042657.0
This makes me feel very uneasy	1651	dmy1ut	thalassophobia	https://i.redd.it/afqxpwlx3pu31.png	37		1572041705.0
I think I've been shadow banned for saying MtF's can’t have a period.	2010	dmxfnq	TrueOffMyChest	https://www.reddit.com/r/TrueOffMyChest/comments/dmxfnq/i_think_ive_been_shadow_banned_for_saying_mtfs/	526	"I signed up a few days ago and I started to post on a regional sub but something seemed off. I checked and discovered that I have been shadow banned even before I submitted my first post. I only had two other posts before I posted to that sub. One is in Legal Advice asking about my neighbours dogs barking and the other was this below that I posted to a thread about Jessica Yaniv claiming to have period cravings. 

  

>It's someone pretending to have a biological function they can't have and they're being put right. Periods cause humiliation in a lot of cultures, period sufferers are refused tampons and pads in holding cells, endometriosis causes insufferable pain, people die in period huts. I got laughed out of class for having period stains on my PE kit. This person doesn't have a period. You shouldn't appropriate the suffering of others, it's offensive. Then again that's what this character is all about, being an offensive caricature of the Trans community. The damage they've done over the years is incalculable.

  

I don't think this is about the dogs. 

 

I'm bloody sickened that you can't even have an opinion about this without being sneakingly banned.

For the record I have no issue with Tran's people. I don't deny that HRT might cause hormonal cravings. *But MtF's don't have periods.* 

I have been though cervical cancer and a brutal rape, both of which made me bleed profusely and every time I have my period, I am retraumatised by it, this is why I'm so sensitive about it. Periods are fucking awful. No woman actually wants them. It's something we suffer through. Trans women suffer through other things that a cis woman doesn't, I would never take that away from them.

And stop with the nicknames, FART, TERF. It's a bully's tactic to silence people. Have a civil conversation and you might find there's a traumatised woman who's sensitive to anyone encroaching on an issue women have spent thousands of years trying to deal with. 

May as well reset the router, get a new account and start all over again, all the social justice warriors hiding behind a mod curtain are now going to ban me."	1572038793.0
