title	score	id	subreddit	url	numofcomments	selftext	created
Felicity Huffman released from prison before end of 14-day sentence	616	dmylfo	entertainment	https://www.nbcnews.com/pop-culture/celebrity/felicity-huffman-released-prison-end-14-day-sentence-n1071921	127		1572044148.0
Sanu at practice. Looking forward to his debut.	1185	dmvyqe	Patriots	https://i.redd.it/wyimtkyt7ou31.jpg	76		1572030909.0
Why would someone trust Gengar to take kids trick-or-treating?	4731	dmsg7m	pokemongo	https://www.reddit.com/r/pokemongo/comments/dmsg7m/why_would_someone_trust_gengar_to_take_kids/	133	"Saw this in a gym tonight after I dropped the Bulbasaur with the Halloween costume. Gengar's smile seems a tad bit unnerving.

[https://imgur.com/Q94NCqe](https://imgur.com/Q94NCqe)"	1572007641.0
Emilia Clarke blonde v brunette	934	dmwtey	Celebhub	https://i.redd.it/ezpm3t7xlou31.jpg	17		1572035663.0
Ik_ihe	824	dmxffh	ik_ihe	https://i.redd.it/mga7eor6vou31.jpg	14		1572038759.0
World Champion RC Helicopter Pilot Demonstrates His Godly Skills	3141	dmwqtp	nextfuckinglevel	https://v.redd.it/p5o4ju6tkou31	136		1572035276.0
Since this is my 200th meme I took the privilege to have some fun	804	dmxetn	overlord	https://i.redd.it/47col64yuou31.jpg	9		1572038678.0
I hate it when I need to pay for everything	1747	dmwthi	antimeme	https://i.redd.it/6ot6ze00mou31.jpg	3		1572035669.0
Cursed_dog	1716	dmzb9p	cursedcomments	https://i.redd.it/cj9w2j3okpu31.png	5		1572047335.0
💙💙 Elles (OC)	1171	dmvyhw	SnowWhites	https://i.redd.it/oco5fb5q7ou31.jpg	12		1572030868.0
Alexander Mattison after getting two long first down runs called back by a penalty	808	dmxa3n	minnesotavikings	https://i.redd.it/8bd9cq00tou31.jpg	34		1572038023.0
Got high for the first time in 3 years last night and made nugget parmigianas	3254	dmt92h	shittyfoodporn	https://i.redd.it/c90wajbopmu31.png	82		1572012709.0
Tim Cook. No regrets after 5 years after coming out	862	dmx2qb	apple	https://appleinsider.com/articles/19/10/24/five-years-after-coming-out-apples-tim-cook-says-he-has-not-regretted-it-for-one-minute	421		1572037041.0
S A L T	707	dmxv3j	SkyrimMemes	https://i.redd.it/cymtz9xg1pu31.png	28		1572040871.0
Not your usual Japan pic. Anata no Warehouse, the famous video arcade in Kawasaki is closing down	831	dmx593	japanpics	https://i.redd.it/7l9qazf6qou31.jpg	31		1572037385.0
Thoughts?	1664	dmuxkx	london	https://i.redd.it/xqqsuk6fonu31.jpg	337		1572024377.0
Upgraded a bit my Kuribu cosplay for Comic Con Russia. Let me light up your world, sinners! >:)	473	dmzulc	ffxiv	https://i.redd.it/3mg07vefppu31.jpg	21		1572049549.0
A reverse silencer found on r/blursedimages	1109	dmw6lg	EnterTheGungeon	https://i.redd.it/iec006hnbou31.png	28		1572032190.0
This piece of shit that intentionally plowed through a local gas station while high on meth(There’s a video and it’s insane). Found his Facebook where he’s showing off his brotherhood tats.	556	dmyyii	beholdthemasterrace	https://i.redd.it/9wo0rx9yfpu31.png	49		1572045745.0
Wallis Day	1599	dmuyk2	gentlemanboners	https://i.imgur.com/0BGWdOS.jpg	25		1572024560.0
Can I offer you a handshake in these troubled times?	1743	dmuzhq	tf2shitposterclub	https://i.redd.it/6m85tlahpnu31.png	30		1572024752.0
Some Friday morning breakfast 😉	820	dmx8iy	pawg	https://i.imgur.com/vRt3ScJ.jpg	14		1572037808.0
SLPT: Just don’t	13559	dmr21r	ShittyLifeProTips	https://i.redd.it/kmamrbijnlu31.png	159		1571999883.0
President Jimmy Carter and Leader of Nigeria Olusegun Obasanjo looking like their about to drop the hottest mixtape (1977)	968	dmymm3	OldSchoolCool	https://i.redd.it/6r39vtiobpu31.png	48		1572044309.0
Hunt or be Hunted by Hary Istiyoso (This is fantastic! Can't wait for the rest of the Layered Armor!)	495	dmzif2	MonsterHunter	https://i.redd.it/4yt6c6twmpu31.jpg	14		1572048165.0
Smart	1473	dmvr4d	DarkHumorAndMemes	https://i.redd.it/jhxosy364ou31.jpg	14		1572029675.0
[CE] Insert good title	1443	dmvapa	RoughRomanMemes	https://i.redd.it/7oe0pj0ovnu31.png	25		1572026814.0
Doom Twitter out here rippin' and tearin'	6064	dmrz6c	Doom	https://i.redd.it/t2zcvuuq2mu31.jpg	180		1572004979.0
Home from mom’s night out...too tipsy and horny to bother taking my clothes off 🙈 *sound on*	1417	dmvavf	milf	https://gfycat.com/bigdaringbuckeyebutterfly	36		1572026847.0
One of our foster kittens do a mighty fine blep	2783	dmtk2z	Blep	https://i.redd.it/3o8nk99wvmu31.png	10		1572014797.0
I'm high and caught this on MasterChef	3980	dmsqti	AccidentalComedy	https://i.redd.it/8qq39x9ufmu31.png	55		1572009390.0
In Red Dead Online, you can find Texas Bluebonnets around certain areas of the map. I did my duty as a Texan to pose with one for a picture.	415	dn0f1m	texas	https://imgur.com/IDYEA8I	12		1572052005.0
All my social media, links in comments <3	1143	dmvz7a	u_Telari_Love	https://gfycat.com/ru/cooldelightfuldrever	3		1572030991.0
Inner City Boston 1978	582	dmylk2	UrbanHell	https://i.redd.it/307z9hk9bpu31.jpg	23		1572044166.0
Chad M.D.	1493	dmv72r	chadsriseup	https://i.redd.it/xk8ka9vstnu31.jpg	14		1572026185.0
🔥 Kodiak bear, the largest subspecies of brown bear 🔥	2410	dmwumc	NatureIsFuckingLit	https://i.redd.it/itapon3imou31.jpg	44		1572035838.0
ich😢iel	4712	dmsqr4	ich_iel	https://i.redd.it/tcx03zitfmu31.png	89		1572009377.0
Sone people just wamt to see the nenos mot work	2304	dmvugb	madlads	https://i.redd.it/eictcsxr5ou31.jpg	46		1572030214.0
tour manager thinks he knows better than the technical staff for a big name comedian, probably cost his job...	710	dmxs3l	ProRevenge	https://www.reddit.com/r/ProRevenge/comments/dmxs3l/tour_manager_thinks_he_knows_better_than_the/	55	"So this happened quite a few years ago. I used to work as a senior technician for a large entertainment venue (around 2000 standing capacity). Most of the time we would have private events etc, but this particular day a very well known comedian was booked to do an hour at the venue. 

Before the show I was expected to meet with his tour manager, discuss his needs, set up stuff etc. He arrives and immediately sets the tone. Personally I think they thought they were ""too big"" to play our venue, but they clearly didn't know what they got into.

""Dave wont use any of your crappy mics, he tours with his own sound system"" 

""Sure, when is it getting here""

""I've got it with me"" the manager said in the most condescending tone ever. He proceeded to pull out a self contained speaker system, no bigger than a suitcase.  There was no way it was going to fill the first two rows of tables, never mind the rest of the venue, which would be at capacity that night. 

""No problem, I can give you a tie line so you can use our speakers""

""That's not acceptable. Dave will only use our speakers and mic.""

To cut a long story short, I spent about 15 minutes arguing with the guy who was belligerent and refused to acknowledge that his crappy system on its own wouldn't fill the venue, and there was no way I could let them do it, without support from us. I explained he would have full control over the sound, my gear was there just to amplify it, I wouldn't need to touch the desk. This still wasnt good enough for him and he threatened to pull Dave from the show.

(Edit for clartity: he was very aggressive and condescending. At a few points he tried to claim I didn't know what I was doing, and that I shouldn't be employed by the company as I was clueless - no matter how much I explained the science etc. He tried to scare me into doing what he wanted by threatening to pull the show - there was no need for this, it was him being stubborn and trying to pull power thinking I would back down and let him cause serious complaints for the venue because of his poor tech knowledge)

He eventually backed down when I told him fine, I'd call the venue manager and explain the situation, I'd get a night off and he wouldn't get paid. Much rather that then hundreds of complaints and refunds. He backed down and we set up for the show. But he was still a jerk and the act was no better. They clearly thought they were better than us and it showed. The act even walked around backstage in his boxers into different peoples dressing rooms without knocking etc. Between them they both managed to annoy everyone. I had enough.

The tour manager had set up a little sound desk at the side of the stage for him to use for ""Dave's"" microphone. He was standing their throughout the show ""mixing his mic"". Where he put himself meant he couldn't hear how it sounded, but could be seen by everyone. My lighting OP and I were at the back of the room a few hundred feet away and hatched our plan. 

The first few minutes of the show were fine until the tour manager moved away from his desk to listen. As he walked away for some strange reason Dave's mic would feedback. He would run back to the desk, try to correct it, but it would solve itself. A couple of minutes later he would walk away and it would start to get that horrible feedback again. Nothing that the audience would notice too much, but Dave and his tour manager certainly did. 

The tour manager was puzzled. He couldn't understand why this was happening and Dave was getting more and more irate, glaring at his manager throughout the act. What they didn't know was that I was watching the manager, and every time he stepped away I turned up the high frequencies on my desk causing the feedback. As he got to the desk I would correct it and get rid of the feedback myself. Rinse and repeat. 

He got so annoyed he came to the back of the venue, barged into our control box and looked at my desk, which of course was set naturally as we had discussed. 

""Have you touched your desk?""

""No mate... actually I did once. Seemed like you were struggling with feedback so I took a bit of the top out.""

He walked away sheepishly back to his desk, about halfway there the mic started feeding back again, this time quite aggressively. He had to run the last 50 foot or so which only drew more attention to him, especially from Dave the comedian.

On his way out the venue I heard the tour manager being chewed out by Dave, about how incompetent he was. 

Few years later I meet Dave at another venue I'm working at. Turns out hes a decent enough guy. Didn't mention the revenge I did on the tour manager, but told him about the gig. Turns out it was one of the last times he used that manager, one of the reasons being how bad that gig was...

TL:DR tour manager thinks he can berate staff and talk down to them, so crew cause feedback during the show so it makes the manager look bad. Turns out to be one of the reasons why he loses a job."	1572040467.0
What’s up with Alita: Battle Angel?	3035	dmt9v3	OutOfTheLoop	https://www.reddit.com/r/OutOfTheLoop/comments/dmt9v3/whats_up_with_alita_battle_angel/	749	"Is Alita: Battle Angel a meme now?

The Academy just recently posted a tweet asking what the best year for movies was, and almost every single reply was “2019 because Alita Battle Angel” or something along those lines. Is this a new meme or were the posts actually genuine?

[Tweet](https://twitter.com/theacademy/status/1173640022265753601?s=21)"	1572012872.0
Splatoon 2 music when searching for a match be like	498	dmze5r	splatoon	https://v.redd.it/p1uvu7v6lpu31	16		1572047672.0
Ukko, the sun god; by me	2379	dmttkd	ImaginaryLeviathans	https://i.redd.it/7xraxq0t0nu31.jpg	31		1572016527.0
Wish me luck in the hospital for the next few weeks	1599	dmv1k4	depression_memes	https://i.redd.it/jx5k0p0oqnu31.jpg	37		1572025131.0
One Of the best Spidey stories Of all Time Since The Death Of Gwen Stacy:Kraven's Last Hunt[Web Of Spiderman #32,1987]	754	dmxdki	comicbooks	https://i.redd.it/fb8a8vleuou31.jpg	44		1572038496.0
Having a boyfriend is making me realized how starved for affection I really was	582	dmyhjw	askgaybros	https://www.reddit.com/r/askgaybros/comments/dmyhjw/having_a_boyfriend_is_making_me_realized_how/	55	"For years I was either alone or doing anonymous hookups. 

But a guy and me really hit it off and holy fuck

Just a few highlights: 

1. I woke up in the morning and he was holding me from behind, he pulled around and kissed my head

2. He got over to my place after work and he tackled me

3. He leans his head on me while we are on the couch watching movies

4. I was playing counterstrike and he grabbed me from behind and teased me

5.He sends me stupid little messages throughout the day. Sometimes it's his butt but not always

6.pretty much any time I'm lying down and he will lie on top of me. 

Honestly it just makes every day so much better. It is worth working on yourself but I'm now starting to understand the people who rush back into relationships. That intimacy (when genuine) is addicting"	1572043691.0
This says a lot.	800	dmx4ev	ufc	https://i.redd.it/1fzo2m0sqou31.jpg	76		1572037276.0
Hungarians protesting Communist rule (October 25, 1956) [4840 x 3103]	3469	dmsx9p	HistoryPorn	https://upload.wikimedia.org/wikipedia/commons/c/c5/Kossuth_Lajos_utca_a_Ferenciek_tere_fel%C5%91l_n%C3%A9zve._1956._okt%C3%B3ber_25-e_d%C3%A9lut%C3%A1n%2C_-_Fortepan_24652.jpg	173		1572010556.0
Sad	576	dmyksa	spooktober	https://i.redd.it/qago64tyapu31.png	12		1572044065.0
Mischievous Otters like to throw stones from there exhibit	1112	dmxs9y	AnimalsBeingJerks	https://gfycat.com/partialmagnificentcopepod	39		1572040488.0
I didn't know if this had been posted here, but the Pixel 4 XL beats iPhone Pro Max in speed test and Ram management was really impressive also.	532	dmyxt3	GooglePixel	https://www.reddit.com/r/GooglePixel/comments/dmyxt3/i_didnt_know_if_this_had_been_posted_here_but_the/	225	https://youtu.be/DtSgdrKztGk	1572045655.0
stolen from a group chat	544	dmyt83	GaySoundsShitposts	https://i.imgur.com/HevEYzj.jpg	6		1572045087.0
There was a $75 reward for a lost cat.	2006	dmujlg	EntitledPeople	https://i.redd.it/vj56542kgnu31.jpg	43		1572021733.0
My wife and me at a work event last weekend. It's now one of my favorite photos	701	dmxltn	GirlsMirin	https://i.redd.it/l9u71tbsxou31.jpg	25		1572039632.0
Cuteness ..	6557	dmtnui	wholesomeanimemes	https://i.redd.it/gqeoo4c1ymu31.jpg	107		1572015504.0
That's gotta hurt, peta	1064	dmw5wv	spiderversedailymemes	https://i.redd.it/8az665zbbou31.jpg	8		1572032081.0
AskScience AMA Series: We mapped human transformation of Earth over the past 10,000 years and the results will surprise you! Ask us anything!	1159	dmvtev	askscience	https://www.reddit.com/r/askscience/comments/dmvtev/askscience_ama_series_we_mapped_human/	119	"When did humans first begin transforming this planet? Our recent article in [*Science*](https://doi.org/10.1126/science.aax1192) brings together more than 250 archaeologists to weigh in on this. By mapping human use of land over the past 10,000 years, we show that human transformation of Earth began much earlier than previously recognized, deepening scientific understanding of the Anthropocene, the age of humans. We're here to answer your questions about this 10,000-year history and how we mapped it.

+ [Archaeological assessment reveals Earth's early transformation through land use](https://doi.org/10.1126/science.aax1192) (Science)
+ [Humans Dominated Earth Earlier Than Previously Thought](https://www.nytimes.com/2019/08/29/science/archaeology-earth-anthropocene.html) (The New York Times)
+ [UMBC's Erle Ellis crowdsources global archaeological research to trace the history of human impacts on Earth](https://news.umbc.edu/umbcs-erle-ellis-crowdsources-global-archaeological-research-to-trace-the-history-of-human-impacts-on-earth/) (UMBC News)
+ [When did humans start to transform Earth? UMBC's Erle Ellis introduces the Anthropocene](https://news.umbc.edu/when-did-humans-start-to-transform-earth-umbcs-erle-ellis-introduces-the-anthropocene/) (UMBC News)

On the AMA today are:

+ [Erle Ellis](https://ges.umbc.edu/ellis/), professor of geography and environmental systems, at the University of Maryland, Baltimore County
+ [Lucas Stephens](http://elpc.org/staff/lucas-stephens/), senior research analyst at the Environmental Law & Policy Center and former UMBC post-doctoral fellow

We are on at 1 p.m. (ET, 17 UT), ask us anything!

----- 

EDIT: [Video](https://twitter.com/erleellis/status/1187105046472876032) just for you!"	1572030055.0
Snitches get stitches	632	dmy1cm	Embroidery	https://imgur.com/SxuOXV9	16		1572041640.0
HOW TO BE BADASS AF “FOR DUMN FUGKS”	1750	dmuofi	THE_PACK	https://i.redd.it/kz9ut7mbjnu31.png	80		1572022665.0
Press F to Pay Respects	748	dmxd3f	techsupportgore	https://i.redd.it/fr92qs52phu31.png	52		1572038435.0
For anyone that's not a fan of either Epic or Game Pass	568	dmymew	fuckepic	https://i.redd.it/svon7blgbpu31.png	149		1572044285.0
[F] I treated myself to a new bra on my lunch break. 🖤	904	dmwkvc	workgonewild	https://gfycat.com/sanedangerousimago	30		1572034368.0
Playtime is over!	913	dmwlei	customhearthstone	https://i.redd.it/2y4lokgxhou31.png	53		1572034457.0
Absolute unit of a maple	611	dmy4gw	Bonsai	https://i.redd.it/b0t78pow4pu31.jpg	30		1572042039.0
meirl	526	dmz9od	meirl	https://i.redd.it/052hryb2kpu31.jpg	11		1572047135.0
What is it with villains and leather jackets!!	602	dmy75s	thewalkingdead	https://i.redd.it/xuhfd5ny5pu31.jpg	77		1572042383.0
MRW I'm the Worm King and I'm trying to court my future Queen.	978	dmwb73	shittyreactiongifs	https://gfycat.com/tensewelloffitaliangreyhound	14		1572032947.0
I made zinogre 【Monster hunter 】	5371	dmxvdh	Minecraft	https://i.redd.it/sdizx6nk1pu31.jpg	58		1572040907.0
Playful death tornado jesters of the sea	1499	dmv055	ProperAnimalNames	https://gfycat.com/menacingfamiliarastarte	53		1572024871.0
Huh	2143	dmw33v	ihadastroke	https://i.redd.it/ymoyi8qs9ou31.png	17		1572031624.0
Now we'll need a foot overhaul mod	409	dn0bpn	ElderScrolls	https://i.redd.it/2sq8h5qdxpu31.jpg	19		1572051603.0
One Piece: Chapter 960	3973	dmsln4	OnePiece	https://www.reddit.com/r/OnePiece/comments/dmsln4/one_piece_chapter_960/	2976	"**Chapter 960: Kozuki Oden Takes the Stage**

**Source** | **Status**
:-----|:-----|:-----
[Official release](https://mangaplus.shueisha.co.jp/titles/100020) | [](/cross)
[JaiminisBox](https://jaiminisbox.com/reader/read/one-piece-2/en/0/960/page/1) | [](/tick)


***

**[Ch. 960 Official Release (Official release)](https://mangaplus.shueisha.co.jp/titles/100020)** 227/10/2019

**Ch. 961 Scan Release:** 01/11/2019 *

---



##Please discuss the manga here and in the theory/discussion post. Any other post will be removed during the next 24 hours.

---

**PS:** Don't forget to check out the official Discord: https://discord.gg/onepiece"	1572008529.0
By not finding jokes about disabled people funny, you’re oppressing yourself, QED	3443	dmt036	SelfAwarewolves	https://i.imgur.com/AVLw3jh.jpg	611		1572011060.0
Interesting design for the Anglosphere flag	3708	dmt384	vexillology	https://i.redd.it/itwmyi01mmu31.jpg	628		1572011644.0
Now you wanna have an eye because they come out meaner than spit and go like a hot damn	851	dmwqmz	Letterkenny	https://i.redd.it/jr4o8xmxyku31.jpg	34		1572035249.0
This picture gets shared around every year. I took it on Halloween at the Kearny Mesa DMV.	459	dmzi74	sandiego	https://i.redd.it/1sgjiah2npu31.jpg	25		1572048139.0
I'm gonna go to the US one day just to buy a Child size soda	3747	dmso3t	PandR	https://i.redd.it/hfr9hvggemu31.jpg	80		1572008918.0
I was thinking bout it, I got like 4 trav shirts, then my son one day will be the coolest kid at school. Then one of u mofos will have a kid w a trav shirt and they’ll meet and they’ll talk “my dad likes trav” and “my dad likes trav” ..... they’ll have the connection In the picture	620	dmy1hf	travisscott	https://i.redd.it/y5d97k4t3pu31.png	13		1572041658.0
Always happens to me	1266	dmvhta	MetalMemes	https://i.redd.it/ck3pwuycznu31.png	3		1572028060.0
*Knyter näven i fickan*	2205	dmu0h3	sweden	https://i.redd.it/11jib2kz4nu31.png	99		1572017840.0
My Favourite Rando-Generated Name	975	dmwa8g	Stellaris	https://i.redd.it/7kja7gggdou31.jpg	28		1572032799.0
Anyone else?	2575	dmtjh4	curlyhair	https://i.redd.it/ija075blvmu31.jpg	63		1572014682.0
Thought this belonged here...	1750	dmule5	delusionalartists	https://i.redd.it/ig4vfqb59ju31.jpg	34		1572022090.0
Feel old yet?	882	dmwnkt	kurzgesagt	https://i.redd.it/7omasi7ejou31.jpg	22		1572034793.0
We have something in common.	898	dmwjit	IncrediblesMemes	https://i.redd.it/rbsxk6efhou31.png	9		1572034178.0
Lol	1097	dmw387	animememes	https://i.redd.it/rhgdm8lv9ou31.jpg	3		1572031648.0
My grandmas 2019 Diary	841	dmws1w	Wellworn	https://i.redd.it/gf9wp376lou31.png	14		1572035464.0
queer🤠irl	3620	dmsqd3	gay_irl	https://i.redd.it/hfmyhzjlfmu31.png	60		1572009304.0
‘Joker’ Has Become The Highest Grossing R-Rated Movie Ever Worldwide With $785.5M, Surpassing 'Deadpool 2'	597	dn0mkp	movies	https://www.google.com/amp/s/www.forbes.com/sites/scottmendelson/2019/10/25/joker-box-office-oscars-r-rated-dc-films-joaquin-phoenix-warner-bros-venom-logan-deadpool/amp/	141		1572052904.0
The person reading this post is hella cute	25989	dmv0hd	teenagers	https://www.reddit.com/r/teenagers/comments/dmv0hd/the_person_reading_this_post_is_hella_cute/	1269	This, however, is not up for discussion. You *are* cute.	1572024933.0
First Blackhawk ride and I had a blast	656	dmxppc	army	https://i.redd.it/brpja9mbzou31.jpg	99		1572040151.0
confused my grandmother with a picture of me and my massive ketchup packet collection	9980	dmqj8w	oldpeoplefacebook	https://i.redd.it/dnmmiz89flu31.jpg	151		1571997138.0
Jumpy toy you got there	25794	dmrvlg	blackmagicfuckery	https://v.redd.it/8slboed81mu31	230		1572004475.0
personal AssIstant	764	dmx2qq	ExtraFabulousComics	https://i.redd.it/501t1ozzpou31.png	18		1572037042.0
Saturn and its rings in near Infrared.	1165	dmx9eu	spaceporn	https://i.redd.it/qqtznqypsou31.jpg	15		1572037931.0
driving on the autobahn	1462	dmv1q0	germany	https://i.redd.it/ywttsierqnu31.png	72		1572025164.0
You should stop	4621	dmvdc1	meme	https://i.redd.it/qytd9zdywnu31.png	170		1572027277.0
Rapid unscheduled cerebrovascular accident	740	dmx8x7	elonmusk	https://i.redd.it/thw2b6nvjlu31.png	8		1572037861.0
First time here! Do these count as squeaks?	1056	dmvydm	CatsWhoSqueak	https://v.redd.it/59cfbp0l7ou31	20		1572030853.0
H@ck the P1@n3t	2802	dmt84p	Cyberpunk	https://i.redd.it/ldakefk5pmu31.jpg	109		1572012525.0
Sooo happy 😃	412	dmzzsj	18_19	https://i.redd.it/dkhaeri4tpu31.jpg	12		1572050172.0
LA at its best in helping a 15 year old who needs advice after their mother was arrested after LAOP's stepdad told the police she threatened to kill him.	872	dmwlpj	bestoflegaladvice	https://www.reddit.com/r/legaladvice/comments/dmorqj/my_mom_was_arrested_and_i_dont_know_what_to_do/	50		1572034501.0
13 Days Left!	713	dmxdgy	DeathStranding	https://i.redd.it/t4lp7kzcuou31.gif	30		1572038482.0
Is this sub open for memes	453	dmzgwd	Sims4	https://i.redd.it/9bvf204nmpu31.jpg	15		1572047992.0
Addison Timlin	782	dmx0xj	celebnsfw	https://i.redd.it/h1kakqb9pou31.jpg	12		1572036765.0
OOOOHHHHHH	822	dmwvfx	argentina	https://i.redd.it/3hoktf7tmou31.jpg	76		1572035951.0
This..	576	dmyhei	cringepics	https://i.redd.it/z8hx2abs9pu31.png	29		1572043668.0
A sketch of Ereh	528	dmyogc	ShingekiNoKyojin	https://i.redd.it/nehqe91ccpu31.jpg	10		1572044529.0
Finally something for a girl like me	13526	dmr9aa	notliketheothergirls	https://i.redd.it/1kf8x5bwqlu31.jpg	103		1572000995.0
🤗	478	dmz58h	2busty2hide	https://i.redd.it/xg59yccgipu31.png	15		1572046583.0
😂😂😂😂😂😂	396	dn04ya	RedDeadOnline	https://i.redd.it/c0vnwu30vpu31.jpg	28		1572050803.0
Here's my first digital portrait. Want to do one of Adam Jones in the future. Bless this Community	961	dmw89s	ToolBand	https://i.redd.it/whsibdlfcou31.jpg	68		1572032470.0
small curvy girl ( I just got braces and my mouth hurts like hell, help 🥺) (OC)(F)(19)	1019	dmw0qq	curvy	https://i.redd.it/16uowt8t8ou31.png	0		1572031236.0
[Cover] Wonder Woman: Year One: Deluxe Edition Textless Cover by Nicola Scott (August 2019)	600	dmy0rt	DCcomics	https://i.redd.it/v6sphdxj3pu31.jpg	14		1572041572.0
Guys I know who sans is now!	768	dmx510	Undertale	https://i.redd.it/rym8pbn0rou31.jpg	30		1572037356.0
Heyyoo Just wanna drop my heartless Sora and heartless army fan-art here😊	973	dmw776	KingdomHearts	https://i.redd.it/6fvgmx8xbou31.jpg	24		1572032298.0
Very interesting name i found in youth academy	860	dmwlp2	FifaCareers	https://i.redd.it/uwv72a1giou31.png	25		1572034499.0
"TIL the original title of Stranger Things was ""Montauk"", based on the coastal city of Montauk, New York in Long Island, where it was to be set and filmed. These were dropped due to expensive/cold weather in Montauk and the title was changed to ""Stranger Things"" after Stephen King's ""Needful Things""."	794	dmwvi3	horror	https://strangerthings.fandom.com/wiki/Montauk	72		1572035957.0
Water naar de zee dragen	1256	dmvjqd	cirkeltrek	https://i.redd.it/dlhk471d0ou31.jpg	27		1572028421.0
Slav Train in Cities: Skylines - Hardbass Edition [Sound on]	418	dmzwdo	CitiesSkylines	https://v.redd.it/pl9reojvrpu31	13		1572049770.0
Found in Holland, MI . It's adorable whatever it is!	700	dmxbho	whatsthisplant	https://i.redd.it/m0edc78jtou31.jpg	75		1572038222.0
