title	score	id	subreddit	url	numofcomments	selftext	created
She can sense tiny human in belly	21635	dmytli	aww	https://v.redd.it/qyjr1d93epu31	502		1572045140.0
John Bolton, fired White House hawk, is negotiating impeachment testimony in new hammer blow to Trump	31447	dmxidm	politics	https://www.nydailynews.com/news/politics/ny-john-bolton-trump-impeachment-20191025-p2ptlbtskjfq7jeimms7chpm4e-story.html	2345		1572039178.0
What a stunt pilot is going through during a show	11137	dmyy6u	toptalent	https://gfycat.com/shinythisadmiralbutterfly	302		1572045700.0
What a lame ass superpower	37128	dmxu45	BlackPeopleTwitter	https://i.imgur.com/HhQKrCT.jpg	909		1572040731.0
She Did It, She Did It	43525	dmxhy2	MadeMeSmile	https://gfycat.com/seriousfrankilladopsis	603		1572039118.0
'JOKER' IS THE MEME OF THE MONTH SEPTEMBER 2019!	35662	dmyzbg	dankmemes	https://i.imgur.com/uuzJqJA.png	301		1572045851.0
Took 1 intro-level programming class starterpack	9692	dmyxhc	starterpacks	https://i.imgur.com/b6b5PB9.jpg	391		1572045616.0
A stand for bikers to hold on to while waiting for the traffic lights in Sweden.	30133	dmxa4h	mildlyinteresting	https://i.redd.it/f5woykszsou31.jpg	893		1572038025.0
I’ll just go to a diner then.	9049	dmyxgw	trippinthroughtime	https://i.imgur.com/DUB8Ycr.jpg	60		1572045616.0
[ FRESH ] JESUS IS KING - KANYE WEST	9029	dmzpd1	Kanye	https://www.reddit.com/r/Kanye/comments/dmzpd1/fresh_jesus_is_king_kanye_west/	5448	"What are your first thoughts on the album? Discuss here!

**GET THE ALBUM: https://kanyewest.lnk.to/JesusIsKing**

***

[Check out our Discord!](https://discord.gg/kanye)

*This thread just acts as a ""live"" thread to throw in your quick reactions to each song. Please consult the [First thoughts](https://redd.it/dmzzw4) thread to share your more extensive thoughts.*"	1572048946.0
Fall looks pretty darn good on this tree in Seattle (OC) [801x1200] @ross_schram	28032	dmwxhq	EarthPorn	https://i.redd.it/bhbtk7iqnou31.jpg	164		1572036254.0
Matt... What more do I have to say?	24046	dmxmxr	madlads	https://i.redd.it/n230m218you31.png	137		1572039782.0
I hand carved The Goose out of basswood	81147	dmwoml	gaming	https://i.redd.it/gxb6o56ujou31.jpg	1109		1572034945.0
When Siskel and Ebert Defended 'Star Wars' After It Was Called Not Cinema	14503	dmx5pw	movies	https://www.hollywoodreporter.com/heat-vision/siskel-ebert-defended-star-wars-it-was-called-not-cinema-1249792	1840		1572037438.0
The things some people need told	20455	dmx2m7	trashy	https://imgur.com/nGr668H	428		1572037023.0
No Jimmy, That's Not how you throw a flashbang!	16546	dmxas3	instant_regret	https://gfycat.com/handmadezealousflatfish	215		1572038109.0
That self appreciating clap though	24664	dmxfhb	WatchPeopleDieInside	https://v.redd.it/qbpg9nm6vou31	192		1572038767.0
Bit of a meta post from a friend who’s a photographer.	23329	dmwveq	ChoosingBeggars	https://i.redd.it/0gvo65ptmou31.png	345		1572035947.0
Double yellow line? who need it?	10821	dmxpgb	IdiotsInCars	https://v.redd.it/k1pqus8wyou31	374		1572040119.0
Cotton candy, Sugar is heated to liquid then spun out tiny holes. Rapidly cooling to fine strands!	16795	dmwrh4	educationalgifs	https://gfycat.com/joviallasthoki	360		1572035373.0
Why ‘Uncomfortable’ Books Like ‘To Kill a Mockingbird’ Are Precisely the Ones Kids Should be Reading	17080	dmwhib	books	https://www.intellectualtakeout.org/article/why-uncomfortable-books-kill-mockingbird-are-precisely-ones-kids-should-be-reading	862		1572033896.0
Chip Skylark - My Shiny Teeth and Me [Pop]	6112	dmyd6j	Music	http://youtu.be/4IRdw_Qgwqc	157		1572043147.0
TIL a legally blind hoarder whose son had not been seen for 20 years was found to have been living with his corpse. His fully clothed skeleton was found in a room filled with cobwebs and garbage, and she reported thinking that he had simply moved out.	55158	dmw4qe	todayilearned	https://gothamist.com/news/blind-brooklyn-woman-may-not-have-known-she-was-living-with-corpse-of-dead-son-for-years	2761		1572031891.0
A living wax model.	9289	dmyi3a	rareinsults	https://i.redd.it/ecdo1u61apu31.png	150		1572043751.0
I love character development.	9695	dmxk20	marvelstudios	https://i.redd.it/n5a7p3qpwou31.png	217		1572039392.0
Air-breathing engine precooler achieves record-breaking Mach 5 performance	8391	dmx4yv	space	https://www.esa.int/Enabling_Support/Space_Engineering_Technology/Air-breathing_engine_precooler_achieves_record-breaking_Mach_5_performance	474		1572037350.0
🔥 Emerald Ice On Baikal Lake, Russia 🔥	20018	dmwtfk	NatureIsFuckingLit	https://i.redd.it/66wckffwlou31.jpg	107		1572035664.0
Three fighters and a warlock? No, no, that's totally cool.	15714	dmwj1a	dndmemes	https://i.imgur.com/aeKxVoA.png	402		1572034113.0
Same feelings.	43142	dmwbd4	pics	https://i.redd.it/kmja5hdzdou31.jpg	150		1572032973.0
Epic legacy of the Sabre	8005	dmxp0b	gifsthatkeepongiving	https://i.imgur.com/uTTH8JE.gifv	228		1572040063.0
What if we did something like this?	41511	dmw7r0	HydroHomies	https://i.redd.it/0l0jdji7cou31.jpg	1310		1572032377.0
If I don't lock on the doors of the patrol car	32432	dmvz8t	Whatcouldgowrong	https://v.redd.it/a57sy3tupju31	614		1572030996.0
It do be like that...	36184	dmwdbg	wholesomememes	https://i.redd.it/o1rcdxnveou31.jpg	252		1572033276.0
Just a stool, nothing suspicious here	22073	dmwcim	Unexpected	https://v.redd.it/b5phyb2beou31	307		1572033145.0
You’ve been granted immortality. You’re a minimum wage worker with a useless degree and crippling student debt. What’s your immortal life plan?	18856	dmwlk3	AskReddit	https://www.reddit.com/r/AskReddit/comments/dmwlk3/youve_been_granted_immortality_youre_a_minimum/	3773		1572034480.0
mini cannon	8312	dmy596	interestingasfuck	https://i.imgur.com/I2oC1O1.gifv	155		1572042138.0
A seaplane takes off without the sea.	7069	dmxp0s	holdmyredbull	https://v.redd.it/sskjkvuzyou31	170		1572040065.0
Offshore windfarms 'can provide more electricity than the world needs'	4917	dmy8vd	UpliftingNews	https://www.theguardian.com/environment/2019/oct/24/offshore-windfarms-can-provide-more-electricity-than-the-world-needs	275		1572042607.0
beg forgive	13709	dmxn81	comedyheaven	https://i.redd.it/4r29yxhcyou31.png	212		1572039821.0
Invest in drunk Orson Welles, a true master	13381	dmwm9b	MemeEconomy	https://i.redd.it/sv8irfzsiou31.jpg	116		1572034594.0
You were a doll, Jon. Your house was a doll's house.	7722	dmydly	imsorryjon	https://i.redd.it/727f2g4q6pu31.jpg	57		1572043193.0
Poor Gollum	10907	dmwoea	lotrmemes	https://i.redd.it/r8e7s5mpjou31.png	84		1572034909.0
What happens inside our mouth when we speak	25101	dmvukn	Damnthatsinteresting	https://v.redd.it/fni1eywp5ou31	702		1572030228.0
my cartoon gets posted a lot every Halloween. guess I'll do it this year. ( for the curious, in comments- the original drawing )	39492	dmvhqw	funny	https://i.imgur.com/6aItFNr.jpg	517		1572028047.0
A robber pulled a gun on the bank clerk and manager saying, “Give me all the money! I need it to set myself up in a trade or profession. You know, initial investment is needed to cover the overheads until my cash flow is established.”	27940	dmvt4n	Jokes	https://www.reddit.com/r/Jokes/comments/dmvt4n/a_robber_pulled_a_gun_on_the_bank_clerk_and/	236	The bank manager said to the clerk, “You’d better do what he says, I think he means business.”	1572030013.0
Not sure if this been here...but my boy seems quite dedicated.	6185	dmxi6x	PraiseTheCameraMan	https://v.redd.it/rblltjbarku31	151		1572039155.0
me irl	33156	dmvn6y	me_irl	https://i.redd.it/5of90y672ou31.png	402		1572029014.0
Curious fish get some pet from diver	12221	dmwlj1	AnimalsBeingBros	https://v.redd.it/4rdohaafiou31	295		1572034476.0
Walmart Plunger Kid	19825	dmw0ie	KidsAreFuckingStupid	https://v.redd.it/23wm22ml8ou31	251		1572031196.0
I did some tweaks for Victorious Aatrox.	4520	dmy9z5	leagueoflegends	https://www.reddit.com/r/leagueoflegends/comments/dmy9z5/i_did_some_tweaks_for_victorious_aatrox/	275	"I created a fan edit based on reviews related to this skin, and I hope you like it

https://i.redd.it/4u97a11r5pu31.png"	1572042756.0
What else could that have been?	19947	dmw04a	facepalm	https://i.redd.it/ymagb9ig8ou31.png	303		1572031139.0
Microburst dumping thousands of gallons of rain on a city at once	14937	dmw4kv	BeAmazed	https://v.redd.it/5t0j2b6oaou31	263		1572031869.0
blessed_duck	32885	dmw2ry	blessedimages	https://i.redd.it/4hjijyos9ou31.jpg	200		1572031564.0
I’m alive!	5744	dmxbz4	rickandmorty	https://i.redd.it/n8m1pyrstou31.png	23		1572038292.0
Congressional Republican Behavior Explained.	18957	dmvb39	PoliticalHumor	https://i.redd.it/7f5ihmauvnu31.jpg	628		1572026889.0
Blursed slide	20656	dmwr7z	blursedimages	https://i.redd.it/huzq6sjykou31.png	129		1572035334.0
How a soap bubble freezes	13810	dmwf2z	oddlysatisfying	https://v.redd.it/65g61gccfou31	139		1572033550.0
Zack Snyder as an unnamed soldier in Wonder Woman	5025	dmxrpr	MovieDetails	https://i.redd.it/0nsblzyqzou31.png	53		1572040417.0
This is Oggy, you can boop her !	34408	dmvayo	rarepuppers	https://i.redd.it/xdj5y5pqvnu31.jpg	320		1572026865.0
Zuckerberg faces heat in Congress: “It’s almost like you think this is a joke”	9106	dmvw2t	technology	https://arstechnica.com/tech-policy/2019/10/zuckerberg-faces-heat-in-congress-its-almost-like-you-think-this-is-a-joke/	828		1572030468.0
Bin in my hotel bathroom	12094	dmwaka	CrappyDesign	https://v.redd.it/m9lkhggkdou31	180		1572032852.0
Just a reminder Kevin Spacey’s accuser has mysteriously died, and Epstein didn’t kill himself.	6777	dmxliq	iamatotalpieceofshit	https://i.redd.it/1yvm653oxou31.png	236		1572039593.0
Trump claims he only blocked military aid to Ukraine in order to pressure that country to crack down on corruption. But his administration has repeatedly tried to slash billions from anti-corruption efforts in Ukraine and around the world.	36310	dmv9y5	worldnews	https://www.salon.com/2019/10/23/trump-tried-to-cut-millions-from-ukraine-anti-corruption-efforts-said-he-was-fighting-corruption/	1729		1572026686.0
Was in the middle of a raid when I spotted the boys chilling.	5893	dmz5kv	Minecraft	https://i.redd.it/rvr9j09kipu31.png	96		1572046632.0
Betrayed	23698	dmvhx2	Wellthatsucks	https://i.imgur.com/mQ0CYKJ.jpg	124		1572028081.0
LPT: If you are making a word document with lots of pictures in it, first insert a 1x1 table and then the picture in it. The weird things that happen with pictures in word won't happen. A bit of an extra work but it makes formatting the document that much easier.	9582	dmw4nb	LifeProTips	https://www.reddit.com/r/LifeProTips/comments/dmw4nb/lpt_if_you_are_making_a_word_document_with_lots/	294		1572031878.0
ROBOT FIGHT	14534	dmvhc6	reallifedoodles	https://gfycat.com/soreacclaimedgecko	94		1572027964.0
This dress is too thin to wear anything under, but that just makes it great for flashing	7635	dmvzl7	BustyPetite	https://i.imgur.com/YLEMisW.jpg	59		1572031055.0
#ImpeachBarr trends after Justice Department reportedly opens criminal inquiry into Mueller's Russia probe	6937	dmxshr	politics	https://www.newsweek.com/impeachbarr-trends-after-justice-department-reportedly-opens-criminal-inquiry-muellers-russia-1467740	372		1572040516.0
UPDATE: AITA for threatening to sue my parents for taking out student loans in my name?	6125	dmx2l4	AmItheAsshole	https://www.reddit.com/r/AmItheAsshole/comments/dmx2l4/update_aita_for_threatening_to_sue_my_parents_for/	376	"https://reddit.com/r/AmItheAsshole/comments/9ysceh/aita_for_threatening_to_sue_my_parents_for_taking/

This update has a happy ending of sorts. Basically what happened is that I did end up having to make a police report about what happened. My parents weren't arrested but they were charged with deceptive practice. As part of a negotiated deal, they agreed to become responsible for the debt and they received 12 months of court supervision.

The student loan company removed the loans from my name then made it clear they planned on suing my parents and myself. My parents for obvious reasons and myself because I benefited from the crime (my degree). My parents and I spoke to a lawyer who agreed that they probably could come after me for at least some of the debt.

Our lawyer and their in-house counsel came up with a deal that basically said if I paid half myself, they'd forever give up their right to sue me or try to collect the other half from me. I wasn't crazy about the deal but it's cheaper than going to court where I'd likely be found to be jointly liable with my parents for the full ~$25,000 and attorney fees.

I paid my part of it three months ago and it's like I've never had student loans. Nothing on my record at all regarding it. My parents sold the boat for a loss and are making payments on the remainder of the balance. They've apologized to me pretty profusely about it and I do think they are remorseful.

As a cherry on top, my brother told me they opened a credit card in his name around the same time they took out the student loans. He only found out after going to purchase a house and the loan officer asked him about it. That was paid off in full before he found out about it though.

I speak to my parents maybe once a month now, more than in the past and our relationship is still fairly cool but not nearly as bad as what it was. Also, I definitely did not go to Christmas last year, I think I will be going this year though.

**Edit regarding why I may have been found jointly liable** - My parents paid 50% of my rent my senior year of college, I also (unhappily while interviewing) lived with them for half a year after school. They asked for half and wiped it off of my credit forever. It's more than 50% of rent but I was done with it. I have a decently-paying job now and wanted to move on. I did a crappy job of wording it but they sold the boat for ~$9000 (paid to the lender), I paid ~$8000 (a little more than what half of my rent was) and they are making payments on their ~$8000. Apologies for not being more clear.

**Edit 2** Alright maybe I should have gotten a differently lawyer. I just wanted it to go away with no lawsuit. Looking like that was short-sighted. Overall, I'm ok with it. I never paid my parents back for the 50% rent in college, they were just going to let it be, I feel like I've made up for that now.

[Really good advice in this comment](https://reddit.com/r/AmItheAsshole/comments/dmx2l4/update_aita_for_threatening_to_sue_my_parents_for/f55m9xs/) if you're worried about it happening to you. Just don't get a shitty lawyer."	1572037017.0
"""Smile for the camera!"""	14574	dmvrkl	Eyebleach	https://i.redd.it/utdwzmkc4ou31.jpg	74		1572029741.0
Wholesome Canada	16082	dmygef	memes	https://i.redd.it/89w9qlid9pu31.jpg	79		1572043531.0
"James Milner: “Virgil gives me plenty of stick - when there’s a game in black & white on TV he'll ask what number I am"""	11330	dmvj80	soccer	https://talksport.com/football/620444/liverpool-james-milner-virgil-van-dijk-old-man	573		1572028341.0
Some people just can't be stopped	45670	dmv8ao	gifs	https://gfycat.com/webbedfamiliarhuia	920		1572026403.0
*unintelligible screaming	3402	dmz92j	PrequelMemes	https://i.redd.it/f1nll9yujpu31.jpg	55		1572047056.0
My son believes he is gay. What do I do?	3453	dmz1fa	AskOuija	https://www.reddit.com/r/AskOuija/comments/dmz1fa/my_son_believes_he_is_gay_what_do_i_do/	330		1572046107.0
Tally of children split at border tops 5,400 in new count	6641	dmwbsk	news	https://abcnews.go.com/US/wireStory/tally-children-split-border-tops-5400-count-66516532	979		1572033036.0
Bernie doesn’t care what rich donors have to say because he doesn’t take their money—and won’t in the general election	4864	dmwzn2	OurPresident	https://i.redd.it/zp9r1vtxblu31.jpg	52		1572036574.0
FOUND MY BRO	7226	dmwh5q	borderlands3	https://i.redd.it/775b3n4lgou31.jpg	164		1572033850.0
They're both just on their phones	34809	dmv8lw	WhitePeopleTwitter	https://i.redd.it/um141j0munu31.jpg	284		1572026458.0
Havana in the afternoon, photography, Me, 2016	21137	dmv54m	Art	https://i.redd.it/nbgbftzksnu31.jpg	496		1572025810.0
The second most loved videogame company	7745	dmwrnr	agedlikemilk	https://i.redd.it/pd9zyo27lou31.jpg	180		1572035400.0
Cancerous 14y olds	18855	dmvkl3	pcmasterrace	https://i.redd.it/mp8ulk3u0ou31.png	359		1572028560.0
hmmm	29346	dmv1xd	hmmm	https://i.imgur.com/ZESPP4S.jpg	161		1572025199.0
E-bike catches on fire and explodes, China, 10/20/2019	3460	dmyc3z	CatastrophicFailure	https://v.redd.it/dm3yuzgoulu31	204		1572043007.0
Add cum to McDonald's sprite for peak vibes	12129	dmvz0t	BrandNewSentence	https://i.redd.it/6vgymd608ou31.png	43		1572030962.0
Ads brought to you by your actual cellphone company. No subscription, no external app	21378	dmv5jc	assholedesign	https://i.redd.it/pfa7wmmwsnu31.jpg	858		1572025885.0
8 years ago, Battlefield 3 was released	56638	dmwa99	gaming	http://giphygifs.s3.amazonaws.com/media/JtzLbz0ySnRSM/giphy.gif	1780		1572032802.0
The Pain is Real	5924	dmy461	HistoryMemes	https://i.redd.it/icuvsz7q4pu31.png	62		1572042005.0
PsBattle: Boy and dog running	18131	dmuzrz	photoshopbattles	https://i.imgur.com/afsBbFl.jpg	223		1572024810.0
Big Bang Theory	7958	dmx43v	sbubby	https://i.redd.it/vld8j91eqou31.png	77		1572037234.0
Hmmmm	10783	dmw17n	BikiniBottomTwitter	https://i.redd.it/crhf1njz8ou31.png	51		1572031319.0
I know I only posted like a second ago but I really like this one and need some love (f)	4712	dmx2hv	gonewild	https://i.redd.it/uj8tuycypou31.jpg	103		1572037002.0
Despite its misleading title, self-avowed white man Woody Harrelson does, in fact, jump in the 1992 film “White Men Can’t Jump.” To this day, Harrelson’s jump remains one of the most shocking twists in cinema history.	11634	dmvmdh	shittymoviedetails	https://i.redd.it/w2lk618s1ou31.png	93		1572028870.0
Incredible transformation, Mr. Dumbledore	7788	dmvrj2	harrypotter	https://i.redd.it/5gtcdrmc4ou31.png	233		1572029734.0
This is lit	5339	dmwltn	likeus	https://v.redd.it/qfh3qrscphu31	52		1572034521.0
This stool-cane	2908	dmyob8	specializedtools	https://v.redd.it/4ljtfsj8cpu31	92		1572044509.0
God’s plan	12861	dmw8ct	DeepFriedMemes	https://i.redd.it/39kutezfcou31.png	91		1572032478.0
Optimus Clarkson, the last autobot	14422	dmvj6q	Bossfight	https://i.redd.it/eb563ml60ou31.png	152		1572028333.0
office chair on a stair	3361	dmyc9h	WinStupidPrizes	https://v.redd.it/2ligcvnv7pu31	119		1572043029.0
anime_irl	6351	dmwmgn	anime_irl	https://i.redd.it/sd5kqsisiou31.jpg	125		1572034621.0
[NO SPOILERS] And a round of applause for...	3681	dmxmkn	gameofthrones	https://i.redd.it/7vnpvb82you31.png	40		1572039737.0
Forbidden cookie dough	6477	dmwmhe	forbiddensnacks	https://i.redd.it/i0tszj2viou31.png	36		1572034624.0
Spoiled little brat.	12762	dmvitt	marvelmemes	https://i.redd.it/0z47qritznu31.jpg	81		1572028256.0
Watching that finale like	21747	dmunfb	freefolk	https://i.redd.it/k2x8eapqinu31.png	234		1572022469.0
Cancel billionaires	3009	dmy64b	LateStageCapitalism	https://i.imgur.com/mCNV3mP.png	113		1572042248.0
to get the last tomato	31560	dmuzdn	therewasanattempt	https://gfycat.com/femalehalfkite	167		1572024733.0
let's do our best to make people like this and their deeds famous, they deserve it.	6863	dmweqw	HumansBeingBros	https://i.redd.it/5wugg0j3fou31.jpg	83		1572033505.0
science	11441	dmy0ch	PewdiepieSubmissions	https://i.redd.it/j9gqthsb3pu31.jpg	112		1572041519.0
The lockers at my school can be forced open with minimal effort while leaving zero signs of forced entry	8814	dmw2gb	mildlyinfuriating	https://v.redd.it/vpg89t939ou31	241		1572031514.0
Sheesh, tough crowd	22592	dmv6ph	Tinder	https://i.imgur.com/XmzWbQk.jpg	466		1572026117.0
One punch man	4125	dmxf2x	HumansAreMetal	https://i.redd.it/ffl1lrk1vou31.jpg	93		1572038710.0
Such a good doggo	9688	dmwgoh	MakeMeSuffer	https://i.imgur.com/CNVNbfV.jpg	135		1572033782.0
Don’t drink drugs kids	2995	dmytxb	FuckYouKaren	https://i.redd.it/lx2xfze6epu31.png	18		1572045181.0
My name is Matt Benedetto and I am the founder of Unnecessary Inventions - where I create fake products that solve problems that don't exist. Croc Gloves, Cuisine Curtain, Avocado on a Stick, and on and on. AMA	2297	dmz3hp	IAmA	https://www.reddit.com/r/IAmA/comments/dmz3hp/my_name_is_matt_benedetto_and_i_am_the_founder_of/	362	"Hello Reddit! My name is Matt Benedetto and I am the creator of [Unnecessary Inventions](https://www.unnecessaryinventions.com/)! For the past 8 months I have been designing and creating products that solve problems that don't actually exist - such as the [Infinity Suacelet](https://www.reddit.com/r/funny/comments/bvbaf9/for_fun_i_design_fake_products_behold_the/), the [Cuisine Curtain](https://www.reddit.com/r/funny/comments/bihtqb/i_like_to_design_ridiculous_fake_products_the/), [AirSticks](https://www.reddit.com/r/pics/comments/axqk7j/i_like_to_design_products_for_fun_that_no_one_is/), [FlopFlips](https://www.reddit.com/r/funny/comments/bq5zeo/my_newest_fake_invention_is_the_flopflips_sandals/), and probably most notably [my Cease and Desist from Crocs](https://www.reddit.com/r/pics/comments/co6h3d/i_got_a_cease_and_desist_for_making_the_crocs/).

I thought I'd take this Friday afternoon to answer all of your burning questions you might have for me about my design process, how I actually make the inventions, where my inspiration comes from, my personal background, and anything else in between. AMA! If you don't have a question - feel free to submit an idea for an Unnecessary Invention you want to see me try and make!

I just launched my first book, 101 Unnecessary Inventions, that features all my inventions I've created to date! [You can click here to order yourself a signed copy!](https://www.unnecessaryinventions.com/shop/101-unnecessary-inventions/)

Plus follow along with all my inventions on [YouTube](https://www.youtube.com/c/unnecessaryinventions), [Instagram](https://www.instagram.com/unnecessaryinventions/), [Twitter](https://twitter.com/mattyxb), and the [Ui Subreddit](https://www.reddit.com/r/UnnecessaryInventions/)!

Now hit me with your best questions!

Proof: https://i.redd.it/jonntdssxju31.jpg"	1572046364.0
Playing a game of catch while sky diving	2706	dmze3b	nextfuckinglevel	https://gfycat.com/bighearteddeadlyelephant	64		1572047665.0
Cursed eggs	13437	dmx2pc	cursedcomments	https://i.redd.it/4exh4ff2qou31.jpg	71		1572037036.0
my cartoon gets posted a lot every Halloween. guess I'll do it this year. ( for the curious, in comments- the original drawing )	7741	dmvhsh	comics	https://i.imgur.com/6aItFNr.jpg	132		1572028056.0
I caved and started putting nails in my studio's walls. No regrets.	5478	dmw71b	CozyPlaces	https://i.redd.it/w39dqoi8aou31.jpg	71		1572032271.0
I might be...	22189	dmui96	ProgrammerHumor	https://i.redd.it/ndtpe9bofnu31.png	265		1572021451.0
Hello, I’m hoping someone can identify this item of clothing, it appears to be a school uniform from the UK. Europol are seeking to identify the geographical location from where this may have originated in a child abuse investigation. This is from r/TraceAnObject.	3523	dmxj7w	CasualUK	https://i.redd.it/7601yk1rwou31.png	186		1572039285.0
R.I.P Morgz :(	9627	dmx1z2	woooosh	https://i.redd.it/5rgd91hppou31.png	96		1572036918.0
maybe maybe maybe	2663	dmyzjc	maybemaybemaybe	https://gfycat.com/seriousfrankilladopsis	49		1572045881.0
In Russia, cat get protec	5010	dmwuiq	ANormalDayInRussia	https://i.redd.it/47fbtmlgmou31.png	36		1572035824.0
[Art] [OC] A recreation of our squishy sorcerer picking on someone twice his size.	7798	dmvlck	DnD	https://i.redd.it/n3cy06i91ou31.png	191		1572028699.0
[Image] You'll achieve everything just don't lose hope!!	22817	dmuo5d	GetMotivated	https://i.redd.it/tvwstui5jnu31.png	885		1572022606.0
Hoping to brighten the day for you Bernie fans up! Hope you enjoy this little funny DBZ crossover pic I found.	4528	dmwd5v	SandersForPresident	https://i.redd.it/rudhi948dou31.jpg	92		1572033253.0
HMC while I try to open my Champagne	3593	dmxfhn	holdmycosmo	https://v.redd.it/c1jmuf37vou31	103		1572038768.0
My botched attempt	5007	dmwpi9	menwritingwomen	https://i.redd.it/r6srblg8kou31.jpg	154		1572035077.0
Woof🍂irl	7061	dmvvxh	woof_irl	https://gfycat.com/academicimpressivefantail	36		1572030444.0
Killing a bear doesn't make you a badass, feeding a bear while one of its cubs humps your leg, that's being a Major Badass	7268	dmx2uf	pics	https://i.redd.it/0psv2a0qpou31.jpg	139		1572037055.0
Like, really don’t...	5325	dmxd34	dontputyourdickinthat	https://i.imgur.com/0tCjSDO.jpg	200		1572038434.0
That awkward moment when you're caught fly-tipping...	5207	dmww52	instantkarma	https://i.imgur.com/iQcy1ze.gifv	288		1572036047.0
Show go on	4545	dmwqje	StrangerThings	https://i.redd.it/p4h9du7pkou31.png	61		1572035233.0
Planting seeds of bullshit	2664	dmyn8k	thatHappened	https://i.redd.it/5pkvhwawbpu31.jpg	168		1572044378.0
Here’s a tough one	5929	dmwd9f	13or30	https://i.redd.it/j7ka3juueou31.png	137		1572033267.0
My User Name.	2649	dmyl8v	IdiotsNearlyDying	https://v.redd.it/e1em97w3bpu31	105		1572044125.0
Off duty cop starter pack	3838	dmz5zl	starterpacks	https://i.redd.it/31dbygfripu31.png	152		1572046687.0
